<!ELEMENT recettes (liste_ingredients, suite_instructions)>

<!ELEMENT liste_ingredients (ingredient)+>
<!ELEMENT ingredient (#PCDATA)>

<!ELEMENT suite_instructions (instruction)*>
<!ELEMENT instruction (#PCDATA)>

